<?xml version="1.0" encoding="utf-8" ?>

<!ELEMENT complements (complement)* >
<!ELEMENT complement (#PCDATA)>
<!ATTLIST complement ref NMTOKENS #REQUIRED>
<!ATTLIST complement node CDATA #REQUIRED>